{
  "admitted_root_id": "k0b02-fixture-runtime",
  "canonical_request_sha256": "b04ae991fbc6358eeb26b2feda00ff85abad7eadb378c4e188072431fa97c75d",
  "causation_id": "fixture-cause-v1",
  "compiler_manifest_sha256": "0000000000000000000000000000000000000000000000000000000000000000",
  "correlation_id": "fixture-correlation-v1",
  "decision_version_id": "decision-v1",
  "expected_revision": 1,
  "idempotency_key": "fixture-run|decision-v1|1",
  "pair_stem": "fixture-decision",
  "partition_digest": "1111111111111111111111111111111111111111111111111111111111111111",
  "phase_id": "K0b-runtime-operational",
  "projection_profile_sha256": "2222222222222222222222222222222222222222222222222222222222222222",
  "run_id": "fixture-run",
  "schema_pins": [],
  "source_seq": 1,
  "stable_identity": "fixture-decision-v1"
}
